{
  "schemaVersion": "0.2.0",
  "project": {
    "id": "anyplan",
    "name": "Anyplan",
    "purpose": "Develop a portable guidance framework for AI-assisted software development and a visual interaction engine for browsing, editing, and adjusting instantiated project guidance.",
    "documentationLanguage": "English",
    "context": "The project is in its bootstrap stage. The current priority is to define a portable framework, instantiate it for Anyplan, keep concrete project research separate from framework definitions, add bounded context-retrieval guidance, and keep the visual engine aligned with the structured guidance contract.",
    "owners": ["fangzhou"]
  },
  "principles": [
    {
      "id": "english-documentation",
      "title": "English documentation",
      "statement": "Durable project documentation, guidance instances, ADRs, logs, framework specifications, and documentation-facing UI text should be written in English.",
      "rationale": "A single documentation language keeps project memory searchable, reviewable, and reusable across future AI sessions and project instances."
    },
    {
      "id": "portable-first",
      "title": "Portable framework first",
      "statement": "The framework body must stay independent of Anyplan and any other concrete project implementation details; project-specific rules belong in project instances or research notes.",
      "rationale": "Separating framework and instance allows the visual engine and guidance model to support many projects."
    },
    {
      "id": "structured-before-visual",
      "title": "Structure before visualization",
      "statement": "The visual engine should read structured guidance data rather than infer workflows from prose documents.",
      "rationale": "A stable data contract is easier to validate, version, and connect to tooling."
    },
    {
      "id": "central-contract",
      "title": "Central working contract",
      "statement": "Each project instance should identify a central guidance artifact that outranks descriptive documents when future work needs durable rules.",
      "rationale": "AI collaboration works better when rules, authority, and conflicts are anchored in a clear source of truth."
    },
    {
      "id": "separate-memory-types",
      "title": "Separate memory types",
      "statement": "Rules, current state, decisions, evidence, roadmap state, development history, and methodology should be represented as distinct document types or records.",
      "rationale": "Separating memory types helps AI and humans recover the right source of truth without rereading the whole archive."
    },
    {
      "id": "bounded-context-retrieval",
      "title": "Bounded context retrieval",
      "statement": "Projects should distinguish authority from retrieval depth and should load deep documents only when task risk, stale summaries, or explicit user intent justifies it.",
      "rationale": "Context budgets are finite even when documents fit technically; deliberate retrieval keeps AI work focused and reduces drift from repeated summaries."
    },
    {
      "id": "vertical-slice-growth",
      "title": "Vertical slice growth",
      "statement": "Projects should prefer small runnable slices that validate architecture before large speculative frameworks.",
      "rationale": "Implementation pressure is often the best test of module boundaries and workflow assumptions."
    },
    {
      "id": "self-application",
      "title": "Self application",
      "statement": "Anyplan development must record task intent, workflow stages, validation results, changed guidance, and open questions.",
      "rationale": "The framework should expose its own gaps through practical use."
    }
  ],
  "roles": [
    {
      "id": "human-owner",
      "name": "Human Project Owner",
      "responsibilities": [
        "Define research direction, product intent, and acceptance criteria",
        "Decide whether core framework concepts are valid",
        "Approve high-impact changes to framework authority, schema, or project direction"
      ],
      "permissions": [
        "Change project goals",
        "Accept, reject, or redirect AI proposals",
        "Revise any guidance document"
      ],
      "handoffRules": [
        "AI may implement a scoped minimum version when ambiguity is low-risk",
        "Human confirmation is required when a change redefines framework authority, schema semantics, or core project direction"
      ]
    },
    {
      "id": "ai-coding-agent",
      "name": "AI Coding Agent",
      "responsibilities": [
        "Recover project context from the guidance map and repository state",
        "Maintain framework documents, schema, project instances, and the visual engine",
        "Check new requests against durable guidance",
        "Implement scoped code and documentation changes",
        "Run available validation and report residual risk"
      ],
      "permissions": [
        "Create and edit repository files",
        "Run local non-destructive commands",
        "Propose workflow, constraint, interface, and document-map changes"
      ],
      "handoffRules": [
        "Do not overwrite user changes",
        "Surface material conflicts before executing contradictory work",
        "Return to the human owner for destructive operations or non-inferable product decisions"
      ]
    },
    {
      "id": "visual-editor",
      "name": "Visual Interaction Engine",
      "responsibilities": [
        "Display documents, workflows, constraints, and interfaces",
        "Allow users to edit project instance guidance",
        "Export guidance JSON or future guidance patches"
      ],
      "permissions": [
        "Read project instance guidance",
        "Create updated JSON after user interaction"
      ],
      "handoffRules": [
        "Framework-body changes should become explicit proposals rather than silent writes",
        "Exported JSON should be checked by schema validation or human review"
      ]
    }
  ],
  "workflows": [
    {
      "id": "default-collaboration-loop",
      "name": "Default AI Collaboration Loop",
      "entrypoints": [
        "A human asks for implementation, review, research, or documentation work",
        "AI detects a gap in the framework, project instance, or visual engine",
        "The visual engine exports a proposed workflow or guidance adjustment"
      ],
      "steps": [
        {
          "id": "capture-intent",
          "title": "Capture Intent",
          "purpose": "Turn a natural-language request into an executable task boundary.",
          "actor": "human-owner, ai-coding-agent",
          "inputs": ["User request", "Current guidance"],
          "actions": [
            "Identify goal, scope, acceptance clues, and unknowns",
            "Make reasonable assumptions only when risk is low"
          ],
          "outputs": ["TaskBrief"],
          "checks": [
            "The task has a deliverable",
            "High-impact choices are flagged for human confirmation"
          ],
          "next": ["recover-context"]
        },
        {
          "id": "recover-context",
          "title": "Recover Context",
          "purpose": "Read the smallest authoritative context needed to act safely.",
          "actor": "ai-coding-agent",
          "inputs": ["TaskBrief", "Guidance document map", "Repository state"],
          "actions": [
            "Read central guidance, current state, task-scope documents, and current files first",
            "Use retrieval-tier metadata to decide whether phase context, deep sources, or archived evidence are needed",
            "Identify existing user changes and relevant source-of-truth documents",
            "Summarize the current structure and risks"
          ],
          "outputs": ["ContextSnapshot", "RetrievalScope"],
          "checks": [
            "Existing user work is preserved",
            "The selected context is sufficient for the task",
            "Deep-source reads have a task-specific reason"
          ],
          "next": ["check-guidance"]
        },
        {
          "id": "check-guidance",
          "title": "Check Guidance",
          "purpose": "Compare the request against durable project rules and source-of-truth documents.",
          "actor": "ai-coding-agent",
          "inputs": ["TaskBrief", "ContextSnapshot", "Principles", "Constraints"],
          "actions": [
            "Identify conflicts with language policy, authority, schema, workflow, or project boundaries",
            "Raise conflicts or propose document updates when direction intentionally changes"
          ],
          "outputs": ["GuidanceConflict or clearance to proceed"],
          "checks": [
            "Material conflicts are not ignored",
            "Intentional direction changes are recorded in the appropriate document"
          ],
          "next": ["plan-change"]
        },
        {
          "id": "plan-change",
          "title": "Plan Change",
          "purpose": "Convert the task into scoped, verifiable implementation steps.",
          "actor": "ai-coding-agent",
          "inputs": ["TaskBrief", "ContextSnapshot", "GuidanceConflict"],
          "actions": [
            "Choose a small implementation path",
            "Identify the validation strategy",
            "Update the task plan when the work is substantial"
          ],
          "outputs": ["Implementation plan or WorkflowPatch"],
          "checks": [
            "The plan is proportionate to the task",
            "The plan preserves framework and instance boundaries"
          ],
          "next": ["implement-change"]
        },
        {
          "id": "implement-change",
          "title": "Implement Change",
          "purpose": "Complete the smallest useful change.",
          "actor": "ai-coding-agent",
          "inputs": ["Implementation plan", "Repository files"],
          "actions": [